[
  {
    "schema_version": "1.0.0",
    "integrity_record_id": "EIR-SCN-02-INCOMPLETE-001",
    "assessment_id": "SCN-02-INCOMPLETE",
    "question_id": "C4-Q02",
    "evidence_id": "EV-C4-012-draft-interested-parties.txt",
    "locator": "EV-C4-012-draft-interested-parties.txt",
    "declared_sha256": null,
    "observed_sha256": "f2b33bd349dd015d2fde54366054b34cfa5e087bb0ec58e0f5614f5c27a3dfdb",
    "evidence_status": "FILE_PRESENT",
    "status_history": [
      {
        "status": "REFERENCED",
        "recorded_at": "2026-09-04T08:15:00+00:00",
        "actor": "agentic.evidence_integrity"
      },
      {
        "status": "FILE_PRESENT",
        "recorded_at": "2026-09-04T08:15:00+00:00",
        "actor": "agentic.evidence_integrity"
      }
    ],
    "deterministic_checks": [
      {
        "check_type": "SAFE_PATH",
        "status": "PASSED",
        "observation": "Evidence resolved within the permitted root."
      },
      {
        "check_type": "FILE_PRESENT",
        "status": "PASSED",
        "observation": "A readable regular file is present."
      }
    ],
    "content_review": null,
    "provenance": {
      "created_at": "2026-09-04T08:15:00+00:00",
      "created_by": "agentic.evidence_integrity",
      "generator": "DETERMINISTIC_RULES",
      "generator_version": "0.1.0",
      "source_refs": [
        "assessment:SCN-02-INCOMPLETE",
        "question:C4-Q02",
        "evidence:EV-C4-012-draft-interested-parties.txt"
      ]
    }
  },
  {
    "schema_version": "1.0.0",
    "integrity_record_id": "EIR-SCN-02-INCOMPLETE-002",
    "assessment_id": "SCN-02-INCOMPLETE",
    "question_id": "C4-Q02",
    "evidence_id": "EV-C4-013-missing-scope.txt",
    "locator": null,
    "declared_sha256": null,
    "observed_sha256": null,
    "evidence_status": "UNABLE_TO_ESTABLISH",
    "status_history": [
      {
        "status": "REFERENCED",
        "recorded_at": "2026-09-04T08:15:00+00:00",
        "actor": "agentic.evidence_integrity"
      },
      {
        "status": "UNABLE_TO_ESTABLISH",
        "recorded_at": "2026-09-04T08:15:00+00:00",
        "actor": "agentic.evidence_integrity"
      }
    ],
    "deterministic_checks": [
      {
        "check_type": "MANIFEST_ENTRY_PRESENT",
        "status": "FAILED",
        "observation": "No manifest entry exists for the evidence identifier."
      }
    ],
    "content_review": null,
    "provenance": {
      "created_at": "2026-09-04T08:15:00+00:00",
      "created_by": "agentic.evidence_integrity",
      "generator": "DETERMINISTIC_RULES",
      "generator_version": "0.1.0",
      "source_refs": [
        "assessment:SCN-02-INCOMPLETE",
        "question:C4-Q02",
        "evidence:EV-C4-013-missing-scope.txt"
      ]
    }
  }
]
